{
  "schema_version": "1.1.0",
  "run_id": "2026-10-19-tau_retail-example",
  "date": "2026-10-19",
  "git_sha": "example",
  "suite_id": "tau_retail",
  "model": "<id from config/allowed_models.txt>",
  "model_version": "<version from config/model_versions.txt>",
  "mode": "live",
  "seed": null,
  "ceiling": "0.05",
  "planned_rollouts": 40,
  "completed_rollouts": 40,
  "counts_by_outcome": {
    "pass": 30,
    "fail": 6,
    "env_miss": 1,
    "timeout": 1,
    "error": 2
  },
  "infra_misses": 1,
  "stopped": null,
  "total_cost_usd": "1.25",
  "per_rollout_cost_usd": [
    "0.03",
    "0.03",
    "0.03",
    "0.03",
    "0.03",
    "0.03",
    "0.03",
    "0.03",
    "0.03",
    "0.03",
    "0.03",
    "0.03",
    "0.03",
    "0.03",
    "0.03",
    "0.03",
    "0.03",
    "0.03",
    "0.03",
    "0.03",
    "0.03",
    "0.03",
    "0.03",
    "0.03",
    "0.03",
    "0.03",
    "0.03",
    "0.03",
    "0.03",
    "0.03",
    "0.03",
    "0.03",
    "0.03",
    "0.03",
    "0.03",
    "0.03",
    "0.03",
    "0.03",
    "0.06",
    "0.05"
  ],
  "total_prompt_tokens": 4800,
  "total_thinking_tokens": 600,
  "total_cached_input_tokens": 120,
  "rollout_duration_p50_s": 12,
  "rollout_duration_max_s": 40
}
